{
  "schema_version": "0.1.0",
  "screen_id": "RUN",
  "mode": "default",
  "title": "Run - In progress",
  "description": "Run screen with active progress, visible Why cues, and one Extreme warning.",
  "ui_state": {
    "selected_tab": "progress",
    "selected_preset_id": "PRESET.TURBO_DRAFT",
    "filters": {
      "phase": "render",
      "progress_percent": "42"
    }
  },
  "bundle": {
    "schema_version": "0.1.0",
    "generated_at_utc": "2000-01-01T00:00:00Z",
    "report": {
      "schema_version": "0.1.0",
      "report_id": "REPORT.UI.EXAMPLE.RUN.DEFAULT.PROGRESS",
      "project_id": "PROJECT.UI.EXAMPLES",
      "profile_id": "PROFILE.FULL_SEND",
      "generated_at": "2000-01-01T00:00:00Z",
      "engine_version": "0.1.0",
      "ontology_version": "0.1.0",
      "session": {
        "stems": []
      },
      "issues": [
        {
          "issue_id": "ISSUE.VALIDATION.CHANNEL_LAYOUT_AMBIGUOUS",
          "severity": 55,
          "confidence": 0.8,
          "message": "Layout metadata fallback in use.",
          "evidence": [
            {
              "evidence_id": "EVID.VALIDATION.CHANNEL_LAYOUT_REASON",
              "value": "layout_trimmed"
            }
          ]
        }
      ],
      "recommendations": [
        {
          "recommendation_id": "REC.UI.EXAMPLE.RUN.PROGRESS.001",
          "action_id": "ACTION.UTILITY.GAIN",
          "risk": "medium",
          "requires_approval": false,
          "params": [],
          "eligible_auto_apply": false,
          "eligible_render": true,
          "extreme": true
        },
        {
          "recommendation_id": "REC.UI.EXAMPLE.RUN.PROGRESS.002",
          "action_id": "ACTION.DOWNMIX.RENDER",
          "risk": "medium",
          "requires_approval": false,
          "params": [],
          "eligible_auto_apply": false,
          "eligible_render": true,
          "extreme": false
        }
      ],
      "run_config": {
        "schema_version": "0.1.0",
        "preset_id": "PRESET.TURBO_DRAFT",
        "profile_id": "PROFILE.FULL_SEND",
        "meters": "truth",
        "render": {
          "out_dir": "C:/mmo/examples/ui/run_progress"
        }
      }
    },
    "dashboard": {
      "profile_id": "PROFILE.FULL_SEND",
      "top_issues": [
        {
          "issue_id": "ISSUE.VALIDATION.CHANNEL_LAYOUT_AMBIGUOUS",
          "severity": 55,
          "summary": "Progress can continue, but verify routing assumptions."
        }
      ],
      "eligible_counts": {
        "auto_apply": 0,
        "render": 2
      },
      "blocked_counts": {
        "auto_apply": 2,
        "render": 0
      },
      "extreme_count": 1,
      "downmix_qa": {
        "has_issues": true,
        "max_delta_lufs": 1.2,
        "max_delta_true_peak": 0.9,
        "min_corr": 0.68
      },
      "mix_complexity": {
        "density_mean": 2.6,
        "density_peak": 5,
        "top_masking_pairs_count": 4
      },
      "vibe_signals": {
        "density_level": "high",
        "masking_level": "medium",
        "translation_risk": "high",
        "notes": [
          "Progress view should keep Extreme and Why feedback visible.",
          "Compare is recommended after this Render pass."
        ]
      },
      "preset_recommendations": [
        {
          "preset_id": "PRESET.TURBO_DRAFT",
          "overlay": "Punch",
          "help_id": "HELP.PRESET.TURBO_DRAFT",
          "reasons": [
            "Fast iteration while run stages execute.",
            "Why: useful for directional checks, not final Safety."
          ]
        },
        {
          "preset_id": "PRESET.VIBE.TRANSLATION_SAFE",
          "overlay": "Safe",
          "help_id": "HELP.PRESET.VIBE.TRANSLATION_SAFE",
          "reasons": [
            "Fallback choice for stable Deliverables.",
            "Use Preview when Extreme count increases."
          ]
        }
      ],
      "deliverables": [
        {
          "deliverable_id": "DELIVERABLE.MAIN.STEREO",
          "label": "Main Stereo",
          "target_layout_id": "LAYOUT.2_0",
          "channel_count": 2,
          "formats": [
            "wav"
          ],
          "output_count": 1
        }
      ],
      "source_tags": {
        "normalized": {
          "title": null,
          "artist": null,
          "album": null,
          "date": null
        },
        "preserved_tag_count": 0,
        "warnings": []
      }
    },
    "ui_copy": {
      "locale": "en-US",
      "entries": {
        "COPY.NAV.RUN": {
          "text": "Run"
        },
        "COPY.BADGE.EXTREME": {
          "text": "Extreme"
        },
        "COPY.BADGE.INFO": {
          "text": "Info"
        },
        "COPY.ACTION.RUN": {
          "text": "Run"
        },
        "COPY.NAV.COMPARE": {
          "text": "Compare"
        }
      }
    },
    "help": {
      "HELP.WORKFLOW.RUN": {
        "title": "One-shot run workflow",
        "short": "Run full workflow with deterministic artifacts."
      }
    },
    "pointers": {
      "project_path": "C:/mmo/examples/ui/project.json",
      "deliverables_index_path": "C:/mmo/examples/ui/run_progress/deliverables_index.json",
      "listen_pack_path": "C:/mmo/examples/ui/run_progress/listen_pack.json"
    }
  },
  "design_hints": {
    "badges_expected": [
      "EXTREME",
      "INFO"
    ],
    "hover_help_ids": [
      "HELP.WORKFLOW.RUN",
      "COPY.BADGE.EXTREME"
    ]
  }
}
